[
  {
    "id": "range:dinosauria:global",
    "entityId": "dinosauria",
    "rangeKind": "global-composite",
    "taxonomicConcept": "Dinosauria fossil-sample and living-bird navigation span",
    "geographicScope": "Candelária Sequence, Paraná Basin, Brazil; living bird continuation",
    "olderMa": 233.2,
    "youngerMa": 0,
    "status": "available",
    "uncertainty": {
      "olderMa": null,
      "youngerMa": null,
      "note": "233.2 Ma is the rounded assemblage and specimen context, not a global dinosaur FAD, crown-node date or uninterrupted record."
    },
    "evidenceBasis": "Buriolestes holotype ULBRA-PVT280 anchors a sampled Late Triassic dinosaur occurrence and living birds extend the route to the present.",
    "confidence": "medium",
    "claimIds": [
      "claim:taxon:dinosauria:root-range"
    ],
    "referenceLocators": [
      {
        "referenceId": "cabreira-2016-buriolestes",
        "locator": "pp. 3090–3095; Figures 1–4; Supplemental Information"
      }
    ],
    "evidenceLevel": "literature-synthesized"
  },
  {
    "id": "range:ornithischia:global",
    "entityId": "ornithischia",
    "rangeKind": "global-composite",
    "taxonomicConcept": "Ornithischia — source-bounded sample window",
    "geographicScope": "Lower Elliot Formation Eocursor sample, South Africa",
    "olderMa": 216.5,
    "youngerMa": 201.4,
    "status": "available",
    "uncertainty": {
      "olderMa": null,
      "youngerMa": null,
      "note": "This display is limited to the source-bounded uppermost-Triassic Eocursor sample and its ICS stage conversion, not an Ornithischia FAD or LAD; numerical stage conversions follow ICS v2026/06 where applicable."
    },
    "evidenceBasis": "The phylogeny of the ornithischian dinosaurs directly anchors the sampled window; the display does not extrapolate it into a global taxon duration.",
    "confidence": "medium",
    "claimIds": [
      "claim:taxon:ornithischia:source-bounded-range-rc49"
    ],
    "referenceLocators": [
      {
        "referenceId": "butler-2008-ornithischian-phylogeny",
        "locator": "1–40; Methods and taxon sample; Results; discussion of unstable nodes"
      },
      {
        "referenceId": "ics-2026-06",
        "locator": "International Chronostratigraphic Chart v2026/06; numerical stage boundaries"
      }
    ],
    "evidenceLevel": "literature-synthesized"
  },
  {
    "id": "range:stegosauria:global",
    "entityId": "stegosauria",
    "rangeKind": "global-composite",
    "taxonomicConcept": "Stegosauria — source-bounded sample window",
    "geographicScope": "Middle Jurassic through Early Cretaceous body-fossil record reviewed by Maidment",
    "olderMa": 174.7,
    "youngerMa": 100.5,
    "status": "available",
    "uncertainty": {
      "olderMa": null,
      "youngerMa": null,
      "note": "This display is limited to the review's stage-level body-fossil coverage, not exact origination or extinction instants; numerical stage conversions follow ICS v2026/06 where applicable."
    },
    "evidenceBasis": "Stegosauria: a historical review of the body fossil record and phylogenetic relationships directly anchors the sampled window; the display does not extrapolate it into a global taxon duration.",
    "confidence": "medium",
    "claimIds": [
      "claim:taxon:stegosauria:source-bounded-range-rc49"
    ],
    "referenceLocators": [
      {
        "referenceId": "maidment-2010-stegosauria-review",
        "locator": "199–210; Abstract and pp. 199–201 fossil-record scope; pp. 205–209 phylogeny and limitations"
      },
      {
        "referenceId": "ics-2026-06",
        "locator": "International Chronostratigraphic Chart v2026/06; numerical stage boundaries"
      }
    ],
    "evidenceLevel": "literature-synthesized"
  },
  {
    "id": "range:ankylosauria:global",
    "entityId": "ankylosauria",
    "rangeKind": "global-composite",
    "taxonomicConcept": "Ankylosauria — numerical range withheld — numerical range withheld",
    "geographicScope": "No numerical geographic-temporal range exposed",
    "olderMa": 0,
    "youngerMa": 0,
    "status": "withheld-pending-provenance",
    "uncertainty": {
      "olderMa": null,
      "youngerMa": null,
      "note": "The former navigation numbers are withdrawn because the morphology matrix tests relationships but does not provide auditable numerical clade endpoints. Zero values are non-display placeholders required by the schema."
    },
    "evidenceBasis": "A source audit of Phylogeny of the ankylosaurian dinosaurs (Ornithischia: Thyreophora) found relationship or taxonomic evidence but no range-fit support for the former numerical display.",
    "confidence": "low",
    "claimIds": [],
    "referenceLocators": [
      {
        "referenceId": "thompson-2012-ankylosauria-phylogeny",
        "locator": "301–312; Methods; strict-consensus results; discussion of Nodosauridae resolution"
      }
    ],
    "evidenceLevel": "withheld-no-range-evidence"
  },
  {
    "id": "range:ankylosaurus:global",
    "entityId": "ankylosaurus",
    "rangeKind": "global-composite",
    "taxonomicConcept": "Ankylosaurus — source-bounded sample window",
    "geographicScope": "Upper Cretaceous Western Interior material reviewed by Carpenter",
    "olderMa": 72.1,
    "youngerMa": 66,
    "status": "available",
    "uncertainty": {
      "olderMa": null,
      "youngerMa": null,
      "note": "This display is limited to the stratigraphic coverage of the redescribed type and referred material, not a global genus FAD or LAD; numerical stage conversions follow ICS v2026/06 where applicable."
    },
    "evidenceBasis": "Redescription of Ankylosaurus magniventris Brown 1908 (Ankylosauridae) from the Upper Cretaceous of the Western Interior of North America directly anchors the sampled window; the display does not extrapolate it into a global taxon duration.",
    "confidence": "medium",
    "claimIds": [
      "claim:taxon:ankylosaurus:source-bounded-range-rc49"
    ],
    "referenceLocators": [
      {
        "referenceId": "carpenter-2004-ankylosaurus-redescription",
        "locator": "961–986; Holotype and referred material; revised diagnosis; stratigraphic and geographic occurrence"
      },
      {
        "referenceId": "ics-2026-06",
        "locator": "International Chronostratigraphic Chart v2026/06; numerical stage boundaries"
      }
    ],
    "evidenceLevel": "literature-synthesized"
  },
  {
    "id": "range:ceratopsia:global",
    "entityId": "ceratopsia",
    "rangeKind": "global-composite",
    "taxonomicConcept": "Ceratopsia — source-bounded sample window",
    "geographicScope": "Cloverly Formation Aquilops holotype interval, Montana, USA",
    "olderMa": 113,
    "youngerMa": 100.5,
    "status": "available",
    "uncertainty": {
      "olderMa": null,
      "youngerMa": null,
      "note": "This display is limited to the Early Cretaceous Aquilops sample interval, not the origin or total duration of Ceratopsia; numerical stage conversions follow ICS v2026/06 where applicable."
    },
    "evidenceBasis": "A Ceratopsian Dinosaur from the Lower Cretaceous of Western North America, and the Biogeography of Neoceratopsia directly anchors the sampled window; the display does not extrapolate it into a global taxon duration.",
    "confidence": "medium",
    "claimIds": [
      "claim:taxon:ceratopsia:source-bounded-range-rc49"
    ],
    "referenceLocators": [
      {
        "referenceId": "farke-2014-aquilops-ceratopsia",
        "locator": "9(12):e112055; Holotype and locality; phylogenetic analysis; biogeographic discussion"
      },
      {
        "referenceId": "ics-2026-06",
        "locator": "International Chronostratigraphic Chart v2026/06; numerical stage boundaries"
      }
    ],
    "evidenceLevel": "literature-synthesized"
  },
  {
    "id": "range:triceratops:global",
    "entityId": "triceratops",
    "rangeKind": "global-composite",
    "taxonomicConcept": "Triceratops — source-bounded sample window",
    "geographicScope": "Latest Cretaceous western North American cranial sample in Longrich and Field",
    "olderMa": 68,
    "youngerMa": 66,
    "status": "available",
    "uncertainty": {
      "olderMa": null,
      "youngerMa": null,
      "note": "This display is limited to the sampled latest-Maastrichtian material used in the Triceratops–Torosaurus test, not complete genus endpoints; numerical stage conversions follow ICS v2026/06 where applicable."
    },
    "evidenceBasis": "Torosaurus Is Not Triceratops: Ontogeny in Chasmosaurine Ceratopsids as a Case Study in Dinosaur Taxonomy directly anchors the sampled window; the display does not extrapolate it into a global taxon duration.",
    "confidence": "medium",
    "claimIds": [
      "claim:taxon:triceratops:source-bounded-range-rc49"
    ],
    "referenceLocators": [
      {
        "referenceId": "longrich-field-2012-triceratops-taxonomy",
        "locator": "7(2):e32623; Methods; cranial comparisons; ontogenetic tests; Discussion"
      },
      {
        "referenceId": "ics-2026-06",
        "locator": "International Chronostratigraphic Chart v2026/06; numerical stage boundaries"
      }
    ],
    "evidenceLevel": "literature-synthesized"
  },
  {
    "id": "range:hadrosauridae:global",
    "entityId": "hadrosauridae",
    "rangeKind": "global-composite",
    "taxonomicConcept": "Hadrosauridae — source-bounded sample window",
    "geographicScope": "Hadrosaurid fossil areas and intervals sampled by Prieto-Márquez",
    "olderMa": 100.5,
    "youngerMa": 66,
    "status": "available",
    "uncertainty": {
      "olderMa": null,
      "youngerMa": null,
      "note": "This display is limited to the source's global historical-biogeography sample, not an exhaustive family record or exact endpoints; numerical stage conversions follow ICS v2026/06 where applicable."
    },